{
  "$schema": "../schema/scene.schema.json",
  "version": 2,
  "camera": {
    "lookfrom": [278, 278, -800],
    "lookat": [278, 278, 0],
    "vup": [0, 1, 0],
    "vfov": 40,
    "defocus_angle": 0,
    "focus_dist": 10
  },
  "render": {
    "width": 600,
    "height": 600,
    "samples_per_pixel": 200,
    "max_depth": 50,
    "background": [0, 0, 0]
  },
  "textures": {
    "red": { "type": "solid_color", "albedo": [0.65, 0.05, 0.05] },
    "white": { "type": "solid_color", "albedo": [0.73, 0.73, 0.73] },
    "green": { "type": "solid_color", "albedo": [0.12, 0.45, 0.15] },
    "emission": { "type": "solid_color", "albedo": [7, 7, 7] },
    "black": { "type": "solid_color", "albedo": [0, 0, 0] },
    "grey": { "type": "solid_color", "albedo": [1, 1, 1] }
  },
  "materials": {
    "red": { "type": "lambertian", "texture": "red" },
    "white": { "type": "lambertian", "texture": "white" },
    "green": { "type": "lambertian", "texture": "green" },
    "light": { "type": "diffuse_light", "texture": "emission" },
    "smoke": { "type": "isotropic", "texture": "black" },
    "fog": { "type": "isotropic", "texture": "grey" }
  },
  "objects": [
    { "type": "quad", "q": [555, 0, 0], "u": [0, 555, 0], "v": [0, 0, 555], "material": "green" },
    { "type": "quad", "q": [0, 0, 0], "u": [0, 555, 0], "v": [0, 0, 555], "material": "red" },
    { "type": "quad", "q": [113, 554, 127], "u": [330, 0, 0], "v": [0, 0, 305], "material": "light" },
    { "type": "quad", "q": [0, 0, 0], "u": [555, 0, 0], "v": [0, 0, 555], "material": "white" },
    { "type": "quad", "q": [555, 555, 555], "u": [-555, 0, 0], "v": [0, 0, -555], "material": "white" },
    { "type": "quad", "q": [0, 0, 555], "u": [555, 0, 0], "v": [0, 555, 0], "material": "white" },
    {
      "type": "constant_medium",
      "density": 0.01,
      "phase_function": "smoke",
      "boundary": {
        "type": "transform",
        "translate": [265, 0, 295],
        "rotate": [0, 15, 0],
        "object": { "type": "box", "a": [0, 0, 0], "b": [165, 330, 165], "material": "white" }
      }
    },
    {
      "type": "constant_medium",
      "density": 0.01,
      "phase_function": "fog",
      "boundary": {
        "type": "transform",
        "translate": [130, 0, 65],
        "rotate": [0, -18, 0],
        "object": { "type": "box", "a": [0, 0, 0], "b": [165, 165, 165], "material": "white" }
      }
    }
  ]
}
